{
  "id": "step-18",
  "title": "Q16 - Resultado (Estratégica)",
  "blocks": [
    {
      "id": "progress-bar-step-18",
      "type": "question-progress",
      "order": 0,
      "properties": {
        "padding": 8
      },
      "content": {
        "stepNumber": 18,
        "totalSteps": 21,
        "showPercentage": true,
        "barColor": "#B89B7A",
        "backgroundColor": "#e5e7eb"
      },
      "parentId": null
    },
    {
      "id": "step-18-question-title",
      "type": "question-title",
      "order": 1,
      "properties": {
        "type": "fade",
        "duration": 300,
        "padding": 16
      },
      "content": {
        "text": "Qual desses resultados você mais gostaria de alcançar?"
      },
      "parentId": null
    },
    {
      "id": "question-hero-18",
      "type": "question-hero",
      "order": 2,
      "properties": {
        "type": "fade",
        "duration": 300,
        "padding": 16
      },
      "content": {
        "questionNumber": "Q16 - RESULTADO",
        "questionText": "Qual desses resultados você mais gostaria de alcançar?",
        "currentQuestion": 16,
        "totalQuestions": 13,
        "progressValue": 81,
        "showProgress": true,
        "logoUrl": "https://res.cloudinary.com/dqljyf76t/image/upload/v1744911572/LOGO_DA_MARCA_GISELE_r14oz2.webp",
        "logoAlt": "Logo Gisele Galvão"
      },
      "parentId": null
    },
    {
      "id": "options-grid-18",
      "type": "options-grid",
      "order": 3,
      "properties": {
        "type": "slideUp",
        "duration": 300,
        "delay": 100,
        "easing": "ease-out",
        "columns": 2,
        "gap": 16
      },
      "content": {
        "options": [
          {
            "id": "montar-looks-facilidade",
            "text": "Montar looks com mais facilidade e confiança",
            "value": "montar-looks-facilidade"
          },
          {
            "id": "usar-que-tenho",
            "text": "Usar o que já tenho e me sentir estilosa",
            "value": "usar-que-tenho"
          },
          {
            "id": "comprar-consciencia",
            "text": "Comprar com mais consciência e sem culpa",
            "value": "comprar-consciencia"
          },
          {
            "id": "ser-admirada",
            "text": "Ser admirada pela imagem que transmito",
            "value": "ser-admirada"
          }
        ],
        "columns": 2,
        "multipleSelection": false,
        "minSelections": 1,
        "maxSelections": 1,
        "showImages": true,
        "imageSize": 256,
        "autoAdvance": true,
        "autoAdvanceDelay": 1500
      },
      "parentId": null
    },
    {
      "id": "navigation-step-18",
      "type": "question-navigation",
      "order": 4,
      "properties": {
        "showBack": true,
        "showNext": true,
        "type": "fade",
        "duration": 300,
        "padding": 16
      },
      "content": {
        "backLabel": "Voltar",
        "nextLabel": "Continuar",
        "backVariant": "outline",
        "nextVariant": "default"
      },
      "parentId": null
    }
  ],
  "metadata": {
    "version": "3.0.0",
    "generatedFrom": "master",
    "generatedAt": "2025-10-30T11:27:34.182Z"
  }
}